{
  "catalog_version": "1.0.0",
  "generated_at": "2026-09-01T20:42:33.777Z",
  "demo_dataset": true,
  "products": [
    {
      "id": "iphone-16-8-128",
      "product_family": "iphone-16",
      "name": "Apple iPhone 16 8GB 128GB",
      "brand": "Apple",
      "category": "smartphones",
      "segments": [
        "flagship",
        "camera"
      ],
      "short_description": "The everyday iPhone, with Camera Control and the Action button.",
      "configuration": {
        "ram_gb": 8,
        "storage_gb": 128
      },
      "pricing": {
        "mrp": 79900,
        "selling_price": 74900,
        "currency": "INR"
      },
      "sku": "APPLE-IP16-8-128",
      "inventory": {
        "quantity": 50
      },
      "specifications": {
        "display_type": "Super Retina XDR OLED",
        "panel_type": "OLED",
        "operating_system": "iOS",
        "water_resistance": "IP68",
        "connector": "USB-C",
        "display_size_in": 6.1,
        "refresh_rate_hz": 60,
        "processor": "Apple A18",
        "camera_mp": 48,
        "battery_mah": 3561,
        "charging_w": 20,
        "weight_kg": 0.17,
        "ram_gb": 8,
        "storage_gb": 128
      },
      "performance": {
        "photography": 9,
        "gaming": 8,
        "battery": 7,
        "display_quality": 8,
        "portability": 9,
        "value": 7
      },
      "use_cases": [
        "photography",
        "daily_use",
        "gaming",
        "calls"
      ],
      "tags": [
        "apple",
        "flagship",
        "ios",
        "usb-c"
      ],
      "compatibility": {
        "platform": "mobile",
        "attributes": {
          "connector": "USB-C"
        },
        "compatible_accessory_types": [
          "phone_case",
          "screen_protector",
          "charger",
          "earbuds"
        ]
      },
      "images": [
        {
          "url": "https://cdn.shopiq.yashgarg.co.in/prod-img/IPhone%2016/Pink.webp",
          "alt": "Apple Apple iPhone 16 8GB 128GB",
          "is_primary": true
        }
      ]
    },
    {
      "id": "iphone-16-8-256",
      "product_family": "iphone-16",
      "name": "Apple iPhone 16 8GB 256GB",
      "brand": "Apple",
      "category": "smartphones",
      "segments": [
        "flagship",
        "camera"
      ],
      "short_description": "The everyday iPhone, with Camera Control and the Action button.",
      "configuration": {
        "ram_gb": 8,
        "storage_gb": 256
      },
      "pricing": {
        "mrp": 89900,
        "selling_price": 84900,
        "currency": "INR"
      },
      "sku": "APPLE-IP16-8-256",
      "inventory": {
        "quantity": 50
      },
      "specifications": {
        "display_type": "Super Retina XDR OLED",
        "panel_type": "OLED",
        "operating_system": "iOS",
        "water_resistance": "IP68",
        "connector": "USB-C",
        "display_size_in": 6.1,
        "refresh_rate_hz": 60,
        "processor": "Apple A18",
        "camera_mp": 48,
        "battery_mah": 3561,
        "charging_w": 20,
        "weight_kg": 0.17,
        "ram_gb": 8,
        "storage_gb": 256
      },
      "performance": {
        "photography": 9,
        "gaming": 8,
        "battery": 7,
        "display_quality": 8,
        "portability": 9,
        "value": 7
      },
      "use_cases": [
        "photography",
        "daily_use",
        "gaming",
        "calls"
      ],
      "tags": [
        "apple",
        "flagship",
        "ios",
        "usb-c"
      ],
      "compatibility": {
        "platform": "mobile",
        "attributes": {
          "connector": "USB-C"
        },
        "compatible_accessory_types": [
          "phone_case",
          "screen_protector",
          "charger",
          "earbuds"
        ]
      },
      "images": [
        {
          "url": "https://cdn.shopiq.yashgarg.co.in/prod-img/IPhone%2016/Pink.webp",
          "alt": "Apple Apple iPhone 16 8GB 256GB",
          "is_primary": true
        }
      ]
    },
    {
      "id": "iphone-16-8-512",
      "product_family": "iphone-16",
      "name": "Apple iPhone 16 8GB 512GB",
      "brand": "Apple",
      "category": "smartphones",
      "segments": [
        "flagship",
        "camera"
      ],
      "short_description": "The everyday iPhone, with Camera Control and the Action button.",
      "configuration": {
        "ram_gb": 8,
        "storage_gb": 512
      },
      "pricing": {
        "mrp": 109900,
        "selling_price": 104900,
        "currency": "INR"
      },
      "sku": "APPLE-IP16-8-512",
      "inventory": {
        "quantity": 10
      },
      "specifications": {
        "display_type": "Super Retina XDR OLED",
        "panel_type": "OLED",
        "operating_system": "iOS",
        "water_resistance": "IP68",
        "connector": "USB-C",
        "display_size_in": 6.1,
        "refresh_rate_hz": 60,
        "processor": "Apple A18",
        "camera_mp": 48,
        "battery_mah": 3561,
        "charging_w": 20,
        "weight_kg": 0.17,
        "ram_gb": 8,
        "storage_gb": 512
      },
      "performance": {
        "photography": 9,
        "gaming": 8,
        "battery": 7,
        "display_quality": 8,
        "portability": 9,
        "value": 7
      },
      "use_cases": [
        "photography",
        "daily_use",
        "gaming",
        "calls"
      ],
      "tags": [
        "apple",
        "flagship",
        "ios",
        "usb-c"
      ],
      "compatibility": {
        "platform": "mobile",
        "attributes": {
          "connector": "USB-C"
        },
        "compatible_accessory_types": [
          "phone_case",
          "screen_protector",
          "charger",
          "earbuds"
        ]
      },
      "images": [
        {
          "url": "https://cdn.shopiq.yashgarg.co.in/prod-img/IPhone%2016/Pink.webp",
          "alt": "Apple Apple iPhone 16 8GB 512GB",
          "is_primary": true
        }
      ]
    },
    {
      "id": "iphone-17-8-256",
      "product_family": "iphone-17",
      "name": "Apple iPhone 17 8GB 256GB",
      "brand": "Apple",
      "category": "smartphones",
      "segments": [
        "flagship",
        "camera"
      ],
      "short_description": "The current standard iPhone, with a brighter 120 Hz display.",
      "configuration": {
        "ram_gb": 8,
        "storage_gb": 256
      },
      "pricing": {
        "mrp": 89900,
        "selling_price": 82900,
        "currency": "INR"
      },
      "sku": "APPLE-IP17-8-256",
      "inventory": {
        "quantity": 40
      },
      "specifications": {
        "display_type": "Super Retina XDR OLED",
        "panel_type": "OLED",
        "operating_system": "iOS",
        "water_resistance": "IP68",
        "connector": "USB-C",
        "display_size_in": 6.3,
        "refresh_rate_hz": 120,
        "processor": "Apple A19",
        "camera_mp": 48,
        "battery_mah": 3700,
        "charging_w": 25,
        "weight_kg": 0.177,
        "ram_gb": 8,
        "storage_gb": 256
      },
      "performance": {
        "photography": 9,
        "gaming": 9,
        "battery": 8,
        "display_quality": 9,
        "portability": 9,
        "value": 7
      },
      "use_cases": [
        "photography",
        "daily_use",
        "gaming",
        "calls",
        "content_creation"
      ],
      "tags": [
        "apple",
        "flagship",
        "ios",
        "120hz"
      ],
      "compatibility": {
        "platform": "mobile",
        "attributes": {
          "connector": "USB-C"
        },
        "compatible_accessory_types": [
          "phone_case",
          "screen_protector",
          "charger",
          "earbuds"
        ]
      },
      "images": [
        {
          "url": "https://cdn.shopiq.yashgarg.co.in/prod-img/IPhone%2016/Pink.webp",
          "alt": "Apple Apple iPhone 17 8GB 256GB",
          "is_primary": true
        }
      ]
    },
    {
      "id": "iphone-17-8-512",
      "product_family": "iphone-17",
      "name": "Apple iPhone 17 8GB 512GB",
      "brand": "Apple",
      "category": "smartphones",
      "segments": [
        "flagship",
        "camera"
      ],
      "short_description": "The current standard iPhone, with a brighter 120 Hz display.",
      "configuration": {
        "ram_gb": 8,
        "storage_gb": 512
      },
      "pricing": {
        "mrp": 109900,
        "selling_price": 102900,
        "currency": "INR"
      },
      "sku": "APPLE-IP17-8-512",
      "inventory": {
        "quantity": 40
      },
      "specifications": {
        "display_type": "Super Retina XDR OLED",
        "panel_type": "OLED",
        "operating_system": "iOS",
        "water_resistance": "IP68",
        "connector": "USB-C",
        "display_size_in": 6.3,
        "refresh_rate_hz": 120,
        "processor": "Apple A19",
        "camera_mp": 48,
        "battery_mah": 3700,
        "charging_w": 25,
        "weight_kg": 0.177,
        "ram_gb": 8,
        "storage_gb": 512
      },
      "performance": {
        "photography": 9,
        "gaming": 9,
        "battery": 8,
        "display_quality": 9,
        "portability": 9,
        "value": 7
      },
      "use_cases": [
        "photography",
        "daily_use",
        "gaming",
        "calls",
        "content_creation"
      ],
      "tags": [
        "apple",
        "flagship",
        "ios",
        "120hz"
      ],
      "compatibility": {
        "platform": "mobile",
        "attributes": {
          "connector": "USB-C"
        },
        "compatible_accessory_types": [
          "phone_case",
          "screen_protector",
          "charger",
          "earbuds"
        ]
      },
      "images": [
        {
          "url": "https://cdn.shopiq.yashgarg.co.in/prod-img/IPhone%2016/Pink.webp",
          "alt": "Apple Apple iPhone 17 8GB 512GB",
          "is_primary": true
        }
      ]
    },
    {
      "id": "iphone-17-pro-12-256",
      "product_family": "iphone-17-pro",